{
 "$schema": "https://json-schema.org/draft/2020-12/schema",
 "additionalProperties": false,
 "properties": {
  "demand_price_bins": {
   "additionalProperties": false,
   "properties": {
    "commodities": {
     "items": {
      "additionalProperties": false,
      "properties": {
       "edges": {
        "items": {
         "type": "number"
        },
        "maxItems": 6,
        "minItems": 6,
        "type": "array"
       },
       "id": {
        "type": "string"
       }
      },
      "required": [
       "id",
       "edges"
      ],
      "type": "object"
     },
     "maxItems": 3,
     "minItems": 3,
     "type": "array"
    },
    "scenario": {
     "type": "string"
    },
    "tag": {
     "pattern": "^(OBSERVED|DERIVED|PREDICTED|SIMULATED|SYNTHETIC)(/(OBSERVED|DERIVED|PREDICTED|SIMULATED|SYNTHETIC))*$",
     "type": "string"
    },
    "unit": {
     "type": "string"
    }
   },
   "required": [
    "scenario",
    "unit",
    "tag",
    "commodities"
   ],
   "type": "object"
  },
  "facts": {
   "items": {
    "additionalProperties": false,
    "properties": {
     "id": {
      "type": "string"
     },
     "label": {
      "type": "string"
     },
     "source": {
      "type": "string"
     },
     "tag": {
      "pattern": "^(OBSERVED|DERIVED|PREDICTED|SIMULATED|SYNTHETIC)(/(OBSERVED|DERIVED|PREDICTED|SIMULATED|SYNTHETIC))*$",
      "type": "string"
     },
     "unit": {
      "type": "string"
     },
     "value": {
      "type": [
       "number",
       "string"
      ]
     }
    },
    "required": [
     "id",
     "label",
     "value",
     "unit",
     "tag",
     "source"
    ],
    "type": "object"
   },
   "minItems": 1,
   "type": "array"
  },
  "generated_at": {
   "type": "string"
  },
  "schema_version": {
   "const": "v1"
  },
  "tags": {
   "additionalProperties": {
    "pattern": "^(OBSERVED|DERIVED|PREDICTED|SIMULATED|SYNTHETIC)(/(OBSERVED|DERIVED|PREDICTED|SIMULATED|SYNTHETIC))*$",
    "type": "string"
   },
   "minProperties": 1,
   "type": "object"
  }
 },
 "required": [
  "schema_version",
  "generated_at",
  "tags",
  "facts",
  "demand_price_bins"
 ],
 "title": "Facts",
 "type": "object"
}
