{"demand_price_bins":{"commodities":[{"edges":[9.0,142.87,187.61,247.48,292.83,384.1],"id":"ambient"},{"edges":[22.0,247.37,323.5,425.08,502.52,658.94],"id":"cold"},{"edges":[14.0,112.71,145.11,187.18,219.66,286.5],"id":"bulk"}],"scenario":"optimized","tag":"DERIVED","unit":"USD per ton"},"facts":[{"id":"demand_nodes","label":"Demand nodes","source":"network.json","tag":"OBSERVED","unit":"places","value":100},{"id":"candidate_sites","label":"Candidate sites","source":"network.json","tag":"SYNTHETIC","unit":"sites","value":14},{"id":"total_demand_tons","label":"Total annual demand","source":"network.json","tag":"SYNTHETIC","unit":"t/yr","value":2589781},{"id":"optimized_cost_usd","label":"Optimized annual cost","source":"solutions.json","tag":"SYNTHETIC/SIMULATED","unit":"USD/yr","value":563621811.62},{"id":"legacy_cost_usd","label":"Legacy footprint annual cost","source":"solutions.json","tag":"SYNTHETIC/SIMULATED","unit":"USD/yr","value":588008702.39},{"id":"saving_vs_legacy_usd","label":"Saving of optimized vs legacy","source":"solutions.json","tag":"SYNTHETIC/SIMULATED","unit":"USD/yr","value":24386890.77},{"id":"saving_vs_legacy_pct","label":"Saving of optimized vs legacy","source":"solutions.json","tag":"SYNTHETIC/SIMULATED","unit":"%","value":4.15},{"id":"optimized_open_sites","label":"Sites opened by the optimum","source":"solutions.json","tag":"SYNTHETIC/SIMULATED","unit":"sites","value":8},{"id":"lp_gap_pct","label":"LP relaxation bound below MILP optimum","source":"solutions.json","tag":"SYNTHETIC/SIMULATED","unit":"%","value":0.28},{"id":"mc_draws","label":"Monte Carlo draws","source":"robustness.json","tag":"SIMULATED","unit":"draws","value":500},{"id":"mc_service_mean_optimized","label":"Mean service level, optimized, disrupted","source":"robustness.json","tag":"SYNTHETIC/SIMULATED","unit":"share","value":0.9812},{"id":"mc_service_mean_legacy","label":"Mean service level, legacy, disrupted","source":"robustness.json","tag":"SYNTHETIC/SIMULATED","unit":"share","value":0.9485},{"id":"mc_cvar95_optimized_usd","label":"CVaR95 adjusted cost, optimized","source":"robustness.json","tag":"SYNTHETIC/SIMULATED","unit":"USD/yr","value":1360732129.69},{"id":"mc_cvar95_legacy_usd","label":"CVaR95 adjusted cost, legacy","source":"robustness.json","tag":"SYNTHETIC/SIMULATED","unit":"USD/yr","value":1731203820.01},{"id":"model_columns","label":"Model columns","source":"model.json","tag":"SYNTHETIC","unit":"columns","value":1640},{"id":"model_rows","label":"Model rows","source":"model.json","tag":"SYNTHETIC","unit":"rows","value":1866},{"id":"parity_vectors","label":"Browser parity vectors","source":"solver_test_vectors.json","tag":"SYNTHETIC","unit":"vectors","value":41},{"id":"haul_in_mi_optimized","label":"Inbound haul, optimized","source":"solutions.json","tag":"SYNTHETIC/SIMULATED","unit":"road-equivalent mi (tons-weighted)","value":576.072},{"id":"haul_out_mi_optimized","label":"Outbound haul, optimized","source":"solutions.json","tag":"SYNTHETIC/SIMULATED","unit":"road-equivalent mi (tons-weighted)","value":203.827},{"id":"cost_per_ton_usd_optimized","label":"Cost per ton, optimized","source":"solutions.json","tag":"SYNTHETIC/SIMULATED","unit":"USD/t","value":217.633},{"id":"haul_in_mi_legacy","label":"Inbound haul, legacy","source":"solutions.json","tag":"SYNTHETIC/SIMULATED","unit":"road-equivalent mi (tons-weighted)","value":686.151},{"id":"haul_out_mi_legacy","label":"Outbound haul, legacy","source":"solutions.json","tag":"SYNTHETIC/SIMULATED","unit":"road-equivalent mi (tons-weighted)","value":243.972},{"id":"cost_per_ton_usd_legacy","label":"Cost per ton, legacy","source":"solutions.json","tag":"SYNTHETIC/SIMULATED","unit":"USD/t","value":227.0496},{"id":"haul_in_mi_demand_surge","label":"Inbound haul, demand_surge","source":"solutions.json","tag":"SYNTHETIC/SIMULATED","unit":"road-equivalent mi (tons-weighted)","value":621.641},{"id":"haul_out_mi_demand_surge","label":"Outbound haul, demand_surge","source":"solutions.json","tag":"SYNTHETIC/SIMULATED","unit":"road-equivalent mi (tons-weighted)","value":174.384},{"id":"cost_per_ton_usd_demand_surge","label":"Cost per ton, demand_surge","source":"solutions.json","tag":"SYNTHETIC/SIMULATED","unit":"USD/t","value":208.8687},{"id":"haul_in_mi_high_freight","label":"Inbound haul, high_freight","source":"solutions.json","tag":"SYNTHETIC/SIMULATED","unit":"road-equivalent mi (tons-weighted)","value":587.862},{"id":"haul_out_mi_high_freight","label":"Outbound haul, high_freight","source":"solutions.json","tag":"SYNTHETIC/SIMULATED","unit":"road-equivalent mi (tons-weighted)","value":175.756},{"id":"cost_per_ton_usd_high_freight","label":"Cost per ton, high_freight","source":"solutions.json","tag":"SYNTHETIC/SIMULATED","unit":"USD/t","value":291.4982},{"id":"haul_in_mi_lean_sites","label":"Inbound haul, lean_sites","source":"solutions.json","tag":"SYNTHETIC/SIMULATED","unit":"road-equivalent mi (tons-weighted)","value":605.439},{"id":"haul_out_mi_lean_sites","label":"Outbound haul, lean_sites","source":"solutions.json","tag":"SYNTHETIC/SIMULATED","unit":"road-equivalent mi (tons-weighted)","value":306.181},{"id":"cost_per_ton_usd_lean_sites","label":"Cost per ton, lean_sites","source":"solutions.json","tag":"SYNTHETIC/SIMULATED","unit":"USD/t","value":229.4186},{"id":"haul_in_mi_storm_optimized","label":"Inbound haul, storm_optimized","source":"solutions.json","tag":"SYNTHETIC/SIMULATED","unit":"road-equivalent mi (tons-weighted)","value":625.375},{"id":"haul_out_mi_storm_optimized","label":"Outbound haul, storm_optimized","source":"solutions.json","tag":"SYNTHETIC/SIMULATED","unit":"road-equivalent mi (tons-weighted)","value":244.953},{"id":"haul_in_mi_storm_legacy","label":"Inbound haul, storm_legacy","source":"solutions.json","tag":"SYNTHETIC/SIMULATED","unit":"road-equivalent mi (tons-weighted)","value":797.192},{"id":"haul_out_mi_storm_legacy","label":"Outbound haul, storm_legacy","source":"solutions.json","tag":"SYNTHETIC/SIMULATED","unit":"road-equivalent mi (tons-weighted)","value":250.89},{"id":"haul_in_mi_relaxed_supply","label":"Inbound haul, relaxed_supply","source":"solutions.json","tag":"SYNTHETIC/SIMULATED","unit":"road-equivalent mi (tons-weighted)","value":621.7},{"id":"haul_out_mi_relaxed_supply","label":"Outbound haul, relaxed_supply","source":"solutions.json","tag":"SYNTHETIC/SIMULATED","unit":"road-equivalent mi (tons-weighted)","value":176.499},{"id":"haul_in_mi_relaxed_capacity","label":"Inbound haul, relaxed_capacity","source":"solutions.json","tag":"SYNTHETIC/SIMULATED","unit":"road-equivalent mi (tons-weighted)","value":606.652},{"id":"haul_out_mi_relaxed_capacity","label":"Outbound haul, relaxed_capacity","source":"solutions.json","tag":"SYNTHETIC/SIMULATED","unit":"road-equivalent mi (tons-weighted)","value":131.813},{"id":"haul_in_mi_relaxed_sites","label":"Inbound haul, relaxed_sites","source":"solutions.json","tag":"SYNTHETIC/SIMULATED","unit":"road-equivalent mi (tons-weighted)","value":605.439},{"id":"haul_out_mi_relaxed_sites","label":"Outbound haul, relaxed_sites","source":"solutions.json","tag":"SYNTHETIC/SIMULATED","unit":"road-equivalent mi (tons-weighted)","value":306.181},{"id":"plant_supply_total_tons","label":"Total plant supply","source":"network.json","tag":"SYNTHETIC","unit":"t/yr","value":3237227},{"id":"demand_over_supply","label":"Demand / plant supply","source":"network.json","tag":"SYNTHETIC","unit":"ratio","value":0.8},{"id":"hero_plant","label":"Hero journey plant","source":"solutions.json","tag":"SYNTHETIC/SIMULATED","unit":"","value":"Fort Worth"},{"id":"hero_site","label":"Hero journey site","source":"solutions.json","tag":"SYNTHETIC/SIMULATED","unit":"","value":"Houston"},{"id":"hero_node","label":"Hero journey city","source":"solutions.json","tag":"SYNTHETIC/SIMULATED","unit":"","value":"San Antonio"},{"id":"hero_tons","label":"Hero journey tons","source":"solutions.json","tag":"SYNTHETIC/SIMULATED","unit":"t/yr","value":19857.0},{"id":"hero_in_mi","label":"Hero inbound leg","source":"network.json","tag":"DERIVED","unit":"road-equivalent mi","value":284.6},{"id":"hero_out_mi","label":"Hero outbound leg","source":"network.json","tag":"DERIVED","unit":"road-equivalent mi","value":227.6},{"id":"mc_full_service_legacy","label":"Draws with full service, legacy","source":"robustness.json","tag":"SYNTHETIC/SIMULATED","unit":"draws","value":176},{"id":"mc_full_service_optimized","label":"Draws with full service, optimized","source":"robustness.json","tag":"SYNTHETIC/SIMULATED","unit":"draws","value":319},{"id":"optimized_lp_sha256_prefix","label":"LP text SHA-256 prefix, optimized","source":"solver_test_vectors.json","tag":"SYNTHETIC","unit":"","value":"bd1680b3be7a"},{"id":"parity_vectors_run","label":"Parity vectors run in HiGHS-wasm","source":"artifacts/evidence/parity_report.json","tag":"SYNTHETIC","unit":"vectors","value":41},{"id":"parity_failures","label":"Parity failures","source":"artifacts/evidence/parity_report.json","tag":"SYNTHETIC","unit":"vectors","value":0},{"id":"parity_wasm_ms_median","label":"HiGHS-wasm median solve (node)","source":"artifacts/evidence/parity_report.json","tag":"SYNTHETIC","unit":"ms","value":58},{"id":"parity_wasm_ms_max","label":"HiGHS-wasm max solve (node)","source":"artifacts/evidence/parity_report.json","tag":"SYNTHETIC","unit":"ms","value":1220}],"generated_at":"2026-10-11T04:03:21Z","schema_version":"v1","tags":{"demand_price_bins":"DERIVED","facts":"SYNTHETIC/SIMULATED"}}
